ID,Название,Описание,Цена,Остаток,Артикул,Изображение,URL,Категория,Дата обновления
"1","Кровать King Size 200x200","Элегантная кровать премиум класса из натурального дерева с ортопедическим основанием",3043,45,"BED-KING-200","https://example.com/bed-king-200.jpg","https://wonderfulbed.ru/products/bed-king-200","1","2026-05-29T14:59:37.258Z"
"2","Кровать Queen Size 160x200","Удобная кровать среднего размера идеальна для спален",2609,32,"BED-QUEEN-160","https://example.com/bed-queen-160.jpg","https://wonderfulbed.ru/products/bed-queen-160","1","2026-05-29T14:59:37.258Z"
"3","Матрас ортопедический","Профессиональный ортопедический матрас для здорового сна",2029,78,"MAT-ORTHO-200","https://example.com/mattress-ortho.jpg","https://wonderfulbed.ru/products/mattress-ortho","2","2026-05-29T14:59:37.258Z"
"4","Подушка анатомическая","Анатомическая подушка с эффектом памяти для правильной поддержки шеи",1232,120,"PILLOW-ANAT","https://example.com/pillow-anatom.jpg","https://wonderfulbed.ru/products/pillow-anatom","3","2026-05-29T14:59:37.258Z"
"5","Одеяло холофайбер","Теплое гипоаллергенное одеяло из холофайбера",1377,95,"BLANKET-HOLO","https://example.com/blanket-holo.jpg","https://wonderfulbed.ru/products/blanket-holo","3","2026-05-29T14:59:37.258Z"
